book_id,title,series,author,description,language,isbn,genres,characters,edition,pages,publisher,publishDate,firstPublishDate,awards,numRatings,ratingsByStars,likedPercent,setting,coverImg,bbeScore,bbeVotes,price
78,The Fellowship of the Ring,The Lord of the Rings #1,J.R.R. Tolkien,"One Ring to rule them all, One Ring to find them, One Ring to bring them all and in the darkeness bind themIn ancient times the Rings of Power were crafted by the Elven-smiths, and Sauron, The Dark Lord, forged the One Ring, filling it with his own power so that he could rule all others. But the One Ring was taken from him, and though he sought it throughout Middle-earth, it remained lost to him. After many ages it fell into the hands of Bilbo Baggins, as told in The Hobbit.In a sleepy village in the Shire, young Frodo Baggins finds himself faced with an immense task, as his elderly cousin Bilbo entrusts the Ring to his care. Frodo must leave his home and make a perilous journey across Middle-earth to the Cracks of Doom, there to destroy the Ring and foil the Dark Lord in his evil purpose.",English,9.78035E+12,"['Classics', 'Adventure', 'Science Fiction Fantasy', 'High Fantasy', 'Epic Fantasy', 'Young Adult', 'Novels', 'Magic', 'Literature', 'Audiobook']","['Frodo Baggins', 'Meriadoc Brandybuck', 'Peregrin Took', 'Gandalf', 'Aragorn', 'Gimli', 'Boromir', 'Bilbo Baggins', 'Tom Bombadil', 'Rúmil', 'Saruman', 'Elrond Half-elven', 'Arwen Undómiel', 'Galadriel', 'Gollum', 'Goldberry', 'Legolas', 'Sam Gamgee']",,527,Ballantine Books,03/28/73,07/29/54,['Publieksprijs voor het Nederlandse Boek Nominee (2002)'],2355237,"['1378340', '616196', '244984', '67680', '48037']",95.0,['Middle-earth'],https://i.gr-assets.com/images/S/compressed.photo.goodreads.com/books/1486871542l/3263607._SY475_.jpg,339244,3820,
79,The Girl with the Dragon Tattoo,Millennium #1,"Stieg Larsson, Reg Keeland (Translator)","Harriet Vanger, a scion of one of Sweden’s wealthiest families disappeared over forty years ago. All these years later, her aged uncle continues to seek the truth. He hires Mikael Blomkvist, a crusading journalist recently trapped by a libel conviction, to investigate. He is aided by the pierced and tattooed punk prodigy Lisbeth Salander. Together they tap into a vein of unfathomable iniquity and astonishing corruption.An international publishing sensation, Stieg Larsson’s The Girl with the Dragon Tattoo combines murder mystery, family saga, love story, and financial intrigue into one satisfyingly complex and entertainingly atmospheric novel.Alternate Cover Edition ISBN 0307269752 (ISBN13: 9780307269751)",English,1E+13,"['Fiction', 'Mystery', 'Suspense', 'Contemporary', 'Adult', 'Adult Fiction', 'Sweden', 'Thriller', 'Audiobook', 'Crime']","['Lisbeth Salander', 'Mikael Blomkvist', 'Erika Berger', 'Dragan Armansky', 'Henrik Vanger', 'Martin Vanger', 'Cecilia Vanger', 'Hans-Erik Wennerström', 'Harriet Vanger', 'Holger Palmgren', 'Nils Bjurman', 'Anita Vanger', 'Birger Vanger', 'Dirch Frode', 'Christer Malm', 'Gustaf Morell', 'Isabella Vanger', 'Gottfried Vanger', 'Jan Köbin']",1st edition,465,Knopf,09/16/08,08/28/05,"['Barry Award for Mystery/Crime Novel Of The Decade (2010)', 'Macavity Award for Best First Mystery Novel (2009)', 'Anthony Award for Best First Novel (2009)', 'Glass Key Award (2006)', 'CWA International Dagger Nominee (2008)', 'Galaxy British Book Awards for Crime Thriller of the Year (2009)', 'Exclusive Books Boeke Prize (2008)', 'Strand Critics Award  Nominee for Best First Novel (2008)']",2607860,"['1181014', '872820', '365843', '109806', '78377']",93.0,"['Stockholm (Sweden)', 'Hedeby Island (Sweden)', 'Hedestad, Stockholm (Sweden)']",https://i.gr-assets.com/images/S/compressed.photo.goodreads.com/books/1327868566l/2429135.jpg,338469,3781,
80,Rebecca,,Daphne du Maurier,"Last night I dreamt I went to Manderley again . . .The novel begins in Monte Carlo, where our heroine is swept off her feet by the dashing widower Maxim de Winter and his sudden proposal of marriage. Orphaned and working as a lady's maid, she can barely believe her luck. It is only when they arrive at his massive country estate that she realizes how large a shadow his late wife will cast over their lives--presenting her with a lingering evil that threatens to destroy their marriage from beyond the grave.",English,9.78032E+12,"['Classics', 'Fiction', 'Mystery', 'Romance', 'Gothic', 'Historical Fiction', 'Thriller', 'Suspense', 'Mystery Thriller', 'Adult']","['Maxim de Winter', 'Mrs. Danvers', 'the second Mrs. de Winter', 'Rebecca de Winter', 'Frank Crowley', 'Jack Favell', 'Beatrice Lacy', 'Giles Lacy']",,449,"Little, Brown and Company",12/17/13,08/28/38,"['National Book Award for Fiction (1938)', 'Anthony Award for Best Novel of the Century (2000)']",450276,"['213838', '152839', '63383', '14209', '6007']",96.0,"['Monte Carlo (Monaco)', 'Cornwall, England']",https://i.gr-assets.com/images/S/compressed.photo.goodreads.com/books/1386605169l/17899948.jpg,332533,3736,
81,1984,,George Orwell,"Among the seminal texts of the 20th century, Nineteen Eighty-Four is a rare work that grows more haunting as its futuristic purgatory becomes more real. Published in 1949, the book offers political satirist George Orwell's nightmarish vision of a totalitarian, bureaucratic world and one poor stiff's attempt to find individuality. The brilliance of the novel is Orwell's prescience of modern life—the ubiquity of television, the distortion of the language—and his ability to construct such a thorough version of hell. Required reading for students since it was published, it ranks among the most terrifying novels ever written.",English,B003JTHWKU,"['Classics', 'Fiction', 'Science Fiction', 'Dystopia', 'Literature', 'Novels', 'Politics', 'School', 'Fantasy', 'Adult']","['Winston Smith', 'Big Brother', ""O'Brien"", 'Emmanuel Goldstein', 'Tom Parsons', 'Syme', 'Julia']",,237,Houghton Mifflin Harcourt,9/3/2013,6/8/2049,"['Prometheus Hall of Fame Award (1984)', 'Locus Award Nominee for All-Time Best Science Fiction Novel (1987)']",3140442,"['1474277', '1025880', '453693', '121946', '64646']",94.0,"['London, England', 'England', 'United Kingdom']",https://i.gr-assets.com/images/S/compressed.photo.goodreads.com/books/1532714506l/40961427._SX318_.jpg,324371,3544,
83,A Tree Grows in Brooklyn,,Betty Smith,"The beloved American classic about a young girl's coming-of-age at the turn of the century, Betty Smith's A Tree Grows in Brooklyn is a poignant and moving tale filled with compassion and cruelty, laughter and heartache, crowded with life and people and incident. The story of young, sensitive, and idealistic Francie Nolan and her bittersweet formative years in the slums of Williamsburg has enchanted and inspired millions of readers for more than sixty years. By turns overwhelming, sublime, heartbreaking, and uplifting, the daily experiences of the unforgettable Nolans are raw with honesty and tenderly threaded with family connectedness -- in a work of literary art that brilliantly captures a unique time and place as well as incredibly rich moments of universal experience.",English,9.78006E+12,"['Classics', 'Fiction', 'Historical Fiction', 'Young Adult', 'Coming Of Age', 'Historical', 'Literature', 'New York', 'Novels', 'Book Club']","['Francie Nolan', 'Neeley Nolan', 'Katie Nolan', 'Johnny Nolan', 'Mary Rommely', 'Sissy Rommely', 'Eva ""Evy"" Rommely Flittman', 'Thomas Rommely', 'Sergeant McShane']",Deckle Page Edition,496,HarperCollins Publishers,05/30/06,08/18/43,['Audie Award for Classic (2002)'],388454,"['192536', '128033', '51805', '11410', '4670']",96.0,"['Williamsburg, Brooklyn, New York (United States)', 'New York City, New York (United States)', 'United States of America', 'New York State (United States)']",https://i.gr-assets.com/images/S/compressed.photo.goodreads.com/books/1327883484l/14891.jpg,309492,3407,5.01
84,A Clockwork Orange,,Anthony Burgess,"In Anthony Burgess's influential nightmare vision of the future, criminals take over after dark. Teen gang leader Alex narrates in fantastically inventive slang that echoes the violent intensity of youth rebelling against society. Dazzling and transgressive, A Clockwork Orange is a frightening fable about good and evil and the meaning of human freedom. This edition includes the controversial last chapter not published in the first edition, and Burgess’s introduction, “A Clockwork Orange Resucked.”",English,9.78039E+12,"['Classics', 'Fiction', 'Science Fiction', 'Dystopia', 'Literature', 'Novels', 'Horror', 'Thriller', 'Crime', 'Modern Classics']","['Pete', 'Alex Jacobi', 'Georgie', 'Dim']",,240,W. W. Norton & Company,05/21/19,10/28/62,['Prometheus Hall of Fame Award (2008)'],601048,"['225177', '216256', '108731', '31645', '19239']",92.0,['England'],https://i.gr-assets.com/images/S/compressed.photo.goodreads.com/books/1549260060l/41817486.jpg,302942,3413,13.05
85,The Road,,Cormac McCarthy,"A searing, postapocalyptic novel destined to become Cormac McCarthy’s masterpiece.A father and his son walk alone through burned America. Nothing moves in the ravaged landscape save the ash on the wind. It is cold enough to crack stones, and when the snow falls it is gray. The sky is dark. Their destination is the coast, although they don’t know what, if anything, awaits them there. They have nothing; just a pistol to defend themselves against the lawless bands that stalk the road, the clothes they are wearing, a cart of scavenged food—and each other.The Road is the profoundly moving story of a journey. It boldly imagines a future in which no hope remains, but in which the father and his son, “each the other’s world entire,” are sustained by love. Awesome in the totality of its vision, it is an unflinching meditation on the worst and the best that we are capable of: ultimate destructiveness, desperate tenacity, and the tenderness that keeps two people alive in the face of total devastation.",English,9.78031E+12,"['Fiction', 'Science Fiction', 'Dystopia', 'Post Apocalyptic', 'Classics', 'Horror', 'Literature', 'Novels', 'Apocalyptic', 'Contemporary']","['The man', 'The boy']",First U.S. Edition,241,Alfred A. Knopf,10/2/2006,09/26/06,"['Pulitzer Prize for Fiction (2007)', 'Locus Award Nominee for Best SF Novel (2007)', 'James Tait Black Memorial Prize for Fiction (2006)', 'The Quill Award for General Fiction (2007)', 'Puddly Award for Fiction (2010)', 'National Book Critics Circle Award Nominee for Fiction (2006)', 'Believer Book Award (2006)', 'Tähtivaeltaja Award (2009)', 'Cena Akademie SFFH for Kniha roku (Book of the Year) (2008)', 'Prix des libraires du Québec for Lauréats hors Québec (2009)', 'International Dublin Literary Award Nominee (2008)', 'The Rooster -- The Morning News Tournament of Books (2007)']",716197,"['271747', '245274', '128293', '45727', '25156']",90.0,['United States of America'],https://i.gr-assets.com/images/S/compressed.photo.goodreads.com/books/1600241424l/6288.jpg,300848,3299,6.83
89,Siddhartha,,"Hermann Hesse, Hilda Rosner (Translator)","Herman Hesse's classic novel has delighted, inspired, and influenced generations of readers, writers, and thinkers. In this story of a wealthy Indian Brahmin who casts off a life of privilege to seek spiritual fulfillment. Hesse synthesizes disparate philosophies--Eastern religions, Jungian archetypes, Western individualism--into a unique vision of life as expressed through one man's search for true meaning.",English,1E+13,"['Classics', 'Fiction', 'Philosophy', 'Religion', 'Spirituality', 'Literature', 'Buddhism', 'German Literature', 'Novels', 'Historical Fiction']","['Siddhartha', 'Govinda', 'Gotama', 'Kamala', 'Vasudeva']",,152,Bantam Books,12/1/1981,10/28/22,[],582674,"['234655', '191515', '109865', '33061', '13578']",92.0,['India'],https://i.gr-assets.com/images/S/compressed.photo.goodreads.com/books/1428715580l/52036.jpg,273019,3047,
90,The Poisonwood Bible,,Barbara Kingsolver,"The Poisonwood Bible is a story told by the wife and four daughters of Nathan Price, a fierce, evangelical Baptist who takes his family and mission to the Belgian Congo in 1959. They carry with them everything they believe they will need from home, but soon find that all of it -- from garden seeds to Scripture -- is calamitously transformed on African soil. What follows is a suspenseful epic of one family's tragic undoing and remarkable reconstruction over the course of three decades in postcolonial Africa.",English,9.78006E+12,"['Fiction', 'Historical Fiction', 'Africa', 'Classics', 'Historical', 'Literary Fiction', 'Literature', 'Novels', 'Religion', 'Adult Fiction']","['Orleanna Price', 'Ruth May Price', 'Rachel Rebeccah Price', 'Leah Price', 'Nathan Price', 'Dr Bud Wharton', 'Adah Price', 'Reverend & Mrs. Underdown']",,546,Harper Perennial Modern Classics,7/5/2005,09/24/98,"['Pulitzer Prize Nominee for Fiction (1999)', 'Orange Prize Nominee for Fiction Shortlist (1999)', 'Book Sense Book of the Year Award for Adult (2000)', 'PEN/Faulkner Award for Fiction Nominee (1999)', 'Independent Publisher Book Award (IPPY) for Audio Fiction - Unabridged (1999)', 'Exclusive Books Boeke Prize (2000)', 'Puddly Award for Novel (2001)', 'International Dublin Literary Award Nominee (2000)']",658743,"['289926', '204614', '104164', '36978', '23061']",91.0,"['Bethlehem, Georgia (United States)', 'Kilanga (Congo)', 'Sanderling Island, Georgia (United States)', 'Leopoldville (Congo)']",https://i.gr-assets.com/images/S/compressed.photo.goodreads.com/books/1412242487l/7244.jpg,271161,2977,4.12
91,The Golden Compass,His Dark Materials #1,Philip Pullman,"Lyra is rushing to the cold, far North, where witch clans and armored bears rule. North, where the Gobblers take the children they steal--including her friend Roger. North, where her fearsome uncle Asriel is trying to build a bridge to a parallel world.Can one small girl make a difference in such great and terrible endeavors? This is Lyra: a savage, a schemer, a liar, and as fierce and true a champion as Roger or Asriel could want--but what Lyra doesn't know is that to help one of them will be to betray the other.",English,9.78068E+12,"['Fantasy', 'Young Adult', 'Fiction', 'Childrens', 'Adventure', 'Science Fiction', 'Science Fiction Fantasy', 'Steampunk', 'Middle Grade', 'Audiobook']","['Lyra Belacqua', 'Pantalaimon', 'Lord Asriel', 'Iorek Byrnison', 'Iofur Raknison', 'Marisa Coulter', 'Lee Scoresby', 'Roger Parslow', 'Serafina Pekkala', 'Hester', 'Farder Coram', 'John Faa', 'Billy Costa']",,399,Alfred A. Knopf Books for Young Readers,04/16/96,7/9/1995,"[""Guardian Children's Fiction Prize (1996)"", ""Audie Award for Children's Titles (2000)"", 'Lincoln Award Nominee (2005)', 'Carnegie Medal (1995)']",1284131,"['513058', '406740', '243241', '76112', '44980']",91.0,"['Oxford, England']",https://i.gr-assets.com/images/S/compressed.photo.goodreads.com/books/1505766203l/119322._SX318_.jpg,257342,2882,1.61
92,Don Quixote,,"Miguel de Cervantes Saavedra, John Rutherford (Translator), Roberto González Echevarría (Introduction)","Don Quixote has become so entranced by reading chivalric romances that he determines to become a knight-errant himself. In the company of his faithful squire, Sancho Panza, his exploits blossom in all sorts of wonderful ways. While Quixote's fancy often leads him astray—he tilts at windmills, imagining them to be giants—Sancho acquires cunning and a certain sagacity. Sane madman and wise fool, they roam the world together, and together they have haunted readers' imaginations for nearly four hundred years.With its experimental form and literary playfulness, Don Quixote has been generally recognized as the first modern novel. The book has been enormously influential on a host of writers, from Fielding and Sterne to Flaubert, Dickens, Melville, and Faulkner, who reread it once a year, ""just as some people read the Bible.""",English,9.78014E+12,"['Classics', 'Fiction', 'Literature', 'Spanish Literature', 'Adventure', 'Novels', 'Historical Fiction', 'Spain', 'Humor', 'Classic Literature']","['Sancho Panza', 'Don Quijote de la Mancha']",Penguin Classics,1023,Penguin Books,02/25/03,10/28/05,"['Will Eisner Comic Industry Awards Nominee for Best Adaptation from Another Medium & Best Humor Publication (2014)', 'Βραβείο Λογοτεχνικής Μετάφρασης ΕΚΕΜΕΛ for Ισπανόφωνη Λογοτεχνία (2010)', 'Premio de traducción literaria Valle Inclán for John Rutherford (2002)']",209688,"['72520', '66539', '48749', '15704', '6176']",90.0,"['La Mancha (Spain)', 'Barcelona, Catalonia (Spain)', 'Spain']",https://i.gr-assets.com/images/S/compressed.photo.goodreads.com/books/1546112331l/3836._SY475_.jpg,253824,2893,9.04
93,Atlas Shrugged,,"Ayn Rand, Leonard Peikoff (Goodreads Author) (Introduction)","This is the story of a man who said that he would stop the motor of the world and did. Was he a destroyer or the greatest of liberators?Why did he have to fight his battle, not against his enemies, but against those who needed him most, and his hardest battle against the woman he loved? What is the world’s motor — and the motive power of every man? You will know the answer to these questions when you discover the reason behind the baffling events that play havoc with the lives of the characters in this story. Tremendous in its scope, this novel presents an astounding panorama of human life — from the productive genius who becomes a worthless playboy — to the great steel industrialist who does not know that he is working for his own destruction — to the philosopher who becomes a pirate — to the composer who gives up his career on the night of his triumph — to the woman who runs a transcontinental railroad — to the lowest track worker in her Terminal tunnels. You must be prepared, when you read this novel, to check every premise at the root of your convictions.This is a mystery story, not about the murder — and rebirth — of man’s spirit. It is a philosophical revolution, told in the form of an action thriller of violent events, a ruthlessly brilliant plot structure and an irresistible suspense. Do you say this is impossible? Well, that is the first of your premises to check.",English,9.78045E+12,"['Classics', 'Philosophy', 'Literature', 'Politics', 'Science Fiction', 'Dystopia', 'Economics', 'Novels', 'Audiobook', 'Fiction']","['Prometheus (mythology)', 'Atlas', 'Dagny Taggart', 'John Galt', 'Hank Rearden', ""Francisco d'Anconia"", 'James Taggart']",,1168,Plume,8/1/1999,10/28/57,"['Prometheus Hall of Fame Award (1983)', 'National Book Award Finalist for Fiction (1958)']",353814,"['127162', '93644', '63882', '32760', '36366']",80.0,[],https://i.gr-assets.com/images/S/compressed.photo.goodreads.com/books/1405868167l/662.jpg,248484,2730,4.41
94,Harry Potter and the Prisoner of Azkaban,Harry Potter #3,"J.K. Rowling, Mary GrandPré (Illustrator)","Harry Potter's third year at Hogwarts is full of new dangers. A convicted murderer, Sirius Black, has broken out of Azkaban prison, and it seems he's after Harry. Now Hogwarts is being patrolled by the dementors, the Azkaban guards who are hunting Sirius. But Harry can't imagine that Sirius or, for that matter, the evil Lord Voldemort could be more frightening than the dementors themselves, who have the terrible power to fill anyone they come across with aching loneliness and despair. Meanwhile, life continues as usual at Hogwarts. A top-of-the-line broom takes Harry's success at Quidditch, the sport of the Wizarding world, to new heights. A cute fourth-year student catches his eye. And he becomes close with the new Defense of the Dark Arts teacher, who was a childhood friend of his father. Yet despite the relative safety of life at Hogwarts and the best efforts of the dementors, the threat of Sirius Black grows ever closer. But if Harry has learned anything from his education in wizardry, it is that things are often not what they seem. Tragic revelations, heartwarming surprises, and high-stakes magical adventures await the boy wizard in this funny and poignant third installment of the beloved series.--scholastic.com",English,9.78044E+12,"['Fantasy', 'Young Adult', 'Fiction', 'Magic', 'Childrens', 'Adventure', 'Middle Grade', 'Audiobook', 'Classics', 'Science Fiction Fantasy']","['Sirius Black', 'Draco Malfoy', 'Ron Weasley', 'Petunia Dursley', 'Vernon Dursley', 'Dudley Dursley', 'Severus Snape', 'Rubeus Hagrid', 'Minerva McGonagall', 'Neville Longbottom', 'Fred Weasley', 'George Weasley', 'Percy Weasley', 'Ginny Weasley', 'Colin Creevey', 'Filius Flitwick', 'Pomona Sprout', 'Arthur Weasley', 'Molly Weasley', 'Cho Chang', 'Marjorie Dursley', 'Cornelius Fudge', 'Remus Lupin', 'Sybil Trelawney', 'Peter Pettigrew', 'Poppy Pomfrey', 'Stan Shunpike', 'Oliver Wood', 'Cedric Diggory', 'Dean Thomas', 'Seamus Finnigan', 'Rolanda Hooch', 'Katie Bell', 'Ernie Prang', 'Albus Dumbledore', 'Harry Potter', 'Hermione Granger']",,435,Scholastic Inc.,5/1/2004,7/8/1999,"['Bram Stoker Award for Best Work for Young Readers (1999)', 'Hugo Award Nominee for Best Novel (2000)', 'Locus Award for Best Fantasy Novel (2000)', ""Whitbread Award for Children's Book of the Year (1999)"", ""Mythopoeic Fantasy Award for Children's Literature (2008)"", 'Books I Loved Best Yearly (BILBY) Awards for Older Readers (2005)', 'Colorado Blue Spruce Young Adult Book Award (2004)', 'Maine Student Book Award (2001)', 'Golden Archer Award for Intermediate (2001)', 'Indian Paintbrush Book Award (2004)', 'Soaring Eagle Book Award (2002)', 'Hotze de Roosprijs (2001)', 'Nestlé Smarties Book Prize for 9–11 years (1999)']",2806471,"['1892635', '668920', '205266', '27227', '12423']",99.0,"['Hogwarts School of Witchcraft and Wizardry (United Kingdom)', 'London, England']",https://i.gr-assets.com/images/S/compressed.photo.goodreads.com/books/1499277281l/5.jpg,247736,2770,5.94
98,The Complete Stories and Poems,,Edgar Allan Poe,"This single volume brings together all of Poe's stories and poems, and illuminates the diverse and multifaceted genius of one of the greatest and most influential figures in American literary history.",English,9.78039E+12,"['Classics', 'Poetry', 'Horror', 'Fiction', 'Short Stories', 'Mystery', 'Gothic', 'Literature', 'Fantasy', 'Classic Literature']",[],,821,"Doubleday & Company, Inc.",08/15/84,10/28/49,[],220153,"['122549', '66630', '24609', '4284', '2081']",97.0,['United States of America'],https://i.gr-assets.com/images/S/compressed.photo.goodreads.com/books/1327942676l/23919.jpg,218309,2533,5.27
100,A Prayer for Owen Meany,,John Irving (Goodreads Author),"Eleven-year-old Owen Meany, playing in a Little League baseball game in Gravesend, New Hampshire, hits a foul ball and kills his best friend's mother. Owen doesn't believe in accidents; he believes he is God's instrument. What happens to Owen after that 1953 foul is both extraordinary and terrifying. At moments a comic, self-deluded victim, but in the end the principal, tragic actor in a divine plan, Owen Meany is the most heartbreaking hero John Irving has yet created.",English,9.78055E+12,"['Fiction', 'Classics', 'Contemporary', 'Literature', 'Literary Fiction', 'Novels', 'Historical Fiction', 'Adult Fiction', 'Coming Of Age', 'American']","['Owen Meany', 'John Wheelwright']",,637,Black Swan,10/28/90,03/28/89,[],285954,"['143125', '87919', '38471', '11140', '5299']",94.0,"['Gravesend, New Hampshire (United States)', 'Toronto, Ontario (Canada)']",https://i.gr-assets.com/images/S/compressed.photo.goodreads.com/books/1260470010l/4473.jpg,207241,2280,2.86
101,"Moby-Dick or, the Whale",,"Herman Melville, Andrew Delbanco (Introduction), Tom Quirk (Notes), Rockwell Kent (Illustrator)","""It is the horrible texture of a fabric that should be woven of ships' cables and hawsers. A Polar wind blows through it, and birds of prey hover over it."" So Melville wrote of his masterpiece, one of the greatest works of imagination in literary history. In part, Moby-Dick is the story of an eerily compelling madman pursuing an unholy war against a creature as vast and dangerous and unknowable as the sea itself. But more than just a novel of adventure, more than an encyclopaedia of whaling lore and legend, the book can be seen as part of its author's lifelong meditation on America. Written with wonderfully redemptive humour, Moby-Dick is also a profound inquiry into character, faith, and the nature of perception.This edition of Moby-Dick, which reproduces the definitive text of the novel, includes invaluable explanatory notes, along with maps, illustrations, and a glossary of nautical terms.",English,9.78014E+12,"['Classics', 'Fiction', 'Literature', 'Adventure', 'Novels', 'Historical Fiction', 'American', 'Classic Literature', '19th Century', 'Unfinished']","['Elijah', 'Stubb', 'Captain Ahab', 'Ishmael', 'Queequeg', 'Starbuck', 'Tashtego', 'Dough-boy', 'Flask', 'Daggoo', 'Fedallah', 'Pippin (""Pip"")', 'Moby Dick', 'Mapple Priest', 'Peleg', 'Bildad', 'Fleece', 'Perth', 'Peter Coffin', 'Aunt Charity', 'Mrs Hussey']",,654,Penguin Classics,02/21/03,10/18/51,"['Audie Award for Solo Narration - Male (2006)', 'Премія імені Максима Рильського (1991)']",479125,"['129483', '125817', '122379', '60815', '40631']",79.0,"['Nantucket Island, Massachusetts (United States)', 'Pacific Ocean', 'Atlantic Ocean', 'New Bedford, Massachusetts (United States)']",https://i.gr-assets.com/images/S/compressed.photo.goodreads.com/books/1327940656l/153747.jpg,202669,2346,1.87
